{
  "schema_version": 1,
  "sources": [
    {
      "id": "src_euler_identity",
      "title": "Euler's identity - Wikipedia",
      "url": "https://en.wikipedia.org/wiki/Euler%27s_identity",
      "publisher": "Wikipedia",
      "retrieved_at": "2026-10-12T05:00:00+00:00",
      "excerpt": "Euler's identity is the equality e^(i*pi) + 1 = 0, connecting five fundamental mathematical constants."
    },
    {
      "id": "src_complex_exponential",
      "title": "Exponential function - Wikipedia",
      "url": "https://en.wikipedia.org/wiki/Exponential_function",
      "publisher": "Wikipedia",
      "retrieved_at": "2026-10-12T05:00:00+00:00",
      "excerpt": "The exponential function can be extended to complex arguments and is connected with sine and cosine through Euler's formula."
    },
    {
      "id": "src_taylor_series",
      "title": "Taylor series - Wikipedia",
      "url": "https://en.wikipedia.org/wiki/Taylor_series",
      "publisher": "Wikipedia",
      "retrieved_at": "2026-10-12T05:00:00+00:00",
      "excerpt": "A Taylor series represents a function as an infinite sum of terms calculated from its derivatives at one point."
    }
  ],
  "nodes": [
    {
      "id": "formula_complex_exponential",
      "name": "Complex exponential function",
      "latex": "e^{ix}=\\cos(x)+i\\sin(x)",
      "aliases": ["Euler's formula", "complex exponential"],
      "topic_tags": ["complex analysis", "trigonometry"],
      "ai_module": {
        "summary": "A bridge between exponential growth and circular motion in the complex plane.",
        "explanation": "The formula writes a complex exponential in terms of cosine and sine. It is commonly used as a prerequisite when interpreting Euler's identity at x = pi.",
        "examples": ["At x = pi, e^(i*pi) = -1."],
        "derivation_steps": [],
        "generated_at": "2026-10-12T05:00:00+00:00"
      },
      "user_module": {
        "notes": "",
        "updated_at": "2026-10-12T05:00:00+00:00"
      },
      "status": "learning",
      "sources": ["src_complex_exponential"],
      "created_at": "2026-10-12T05:00:00+00:00",
      "updated_at": "2026-10-12T05:00:00+00:00"
    },
    {
      "id": "formula_taylor_series",
      "name": "Taylor series",
      "latex": "f(x)=\\sum_{n=0}^{\\infty}\\frac{f^{(n)}(a)}{n!}(x-a)^n",
      "aliases": ["Taylor expansion"],
      "topic_tags": ["calculus", "series"],
      "ai_module": {
        "summary": "A local power-series representation built from a function's derivatives.",
        "explanation": "Taylor series provide one standard route for defining and analyzing exponential and trigonometric functions as infinite series.",
        "examples": ["e^x = 1 + x + x^2/2! + x^3/3! + ..."],
        "derivation_steps": [],
        "generated_at": "2026-10-12T05:00:00+00:00"
      },
      "user_module": {
        "notes": "",
        "updated_at": "2026-10-12T05:00:00+00:00"
      },
      "status": "reviewed",
      "sources": ["src_taylor_series"],
      "created_at": "2026-10-12T05:00:00+00:00",
      "updated_at": "2026-10-12T05:00:00+00:00"
    },
    {
      "id": "formula_euler_identity",
      "name": "Euler's identity",
      "latex": "e^{i\\pi}+1=0",
      "aliases": ["Euler identity", "e^(i*pi) + 1 = 0"],
      "topic_tags": ["complex analysis", "calculus"],
      "ai_module": {
        "summary": "A compact identity connecting five fundamental mathematical constants.",
        "explanation": "Euler's identity follows by evaluating Euler's formula at x = pi. Its compact form links the complex exponential with the additive and multiplicative identities.",
        "examples": ["e^(i*pi) + 1 = 0"],
        "derivation_steps": [
          "Start from e^(i*x) = cos(x) + i*sin(x).",
          "Set x = pi.",
          "Use cos(pi) = -1 and sin(pi) = 0 to obtain e^(i*pi) + 1 = 0."
        ],
        "generated_at": "2026-10-12T05:00:00+00:00"
      },
      "user_module": {
        "notes": "Compare the identity with the unit-circle interpretation.",
        "updated_at": "2026-10-12T05:00:00+00:00"
      },
      "status": "new",
      "sources": ["src_euler_identity", "src_complex_exponential", "src_taylor_series"],
      "created_at": "2026-10-12T05:00:00+00:00",
      "updated_at": "2026-10-12T05:00:00+00:00"
    }
  ],
  "edges": [
    {
      "id": "edge_complex_to_euler",
      "source_id": "formula_complex_exponential",
      "target_id": "formula_euler_identity",
      "relation": "prerequisite",
      "rationale": "Evaluating the complex exponential formula at x = pi produces Euler's identity.",
      "sources": ["src_euler_identity", "src_complex_exponential"],
      "verification_status": "ai_suggested",
      "created_at": "2026-10-12T05:00:00+00:00",
      "updated_at": "2026-10-12T05:00:00+00:00"
    },
    {
      "id": "edge_taylor_to_euler",
      "source_id": "formula_taylor_series",
      "target_id": "formula_euler_identity",
      "relation": "derivation_basis",
      "rationale": "Series definitions of the exponential and trigonometric functions provide a derivation basis for Euler's formula and its special case.",
      "sources": ["src_euler_identity", "src_taylor_series"],
      "verification_status": "user_verified",
      "created_at": "2026-10-12T05:00:00+00:00",
      "updated_at": "2026-10-12T05:00:00+00:00"
    }
  ]
}
